{
  "schema": "skyrim-forge-external-worker/1",
  "job_id": "loot-example",
  "worker_type": "loot",
  "operation": "analyze_sort",
  "inputs": {"plugins_file": "<Profile>/plugins.txt", "loadorder_file": "<Profile>/loadorder.txt"},
  "options": {"game": "skyrimse"},
  "output_dir": "<Workspace>/LOOT"
}
